{
  "id": "clock-lesson-doctors_day",
  "title": "The Doctor's Day",
  "number": 9,
  "guide": "cat",
  "source": "Clock",
  "pageControls": ["LOAD_PROFILE_DOCTOR"],
  "criteria": ["uw.community", "cl.sequencing-language", "cl.topic-vocabulary"],
  "steps": [
    {
      "prompt": "Doctors help people who are poorly and make them feel better. They work at a hospital.",
      "badge": "doctor",
      "expect": "BADGE_TAPPED"
    },
    {
      "prompt": "Eight o'clock — the doctor arrives and gets ready. There are lots of people to help today! Press Arrive at hospital!",
      "expect": "PRESET_DOCTOR_ARRIVE_SELECTED"
    },
    {
      "prompt": "Then the doctor sees patients — people who need help.",
      "badge": "then",
      "expect": "BADGE_TAPPED"
    },
    {
      "prompt": "Ten o'clock — the doctor listens carefully to each person and helps them feel better. That is very important work. Press See patients!",
      "expect": "PRESET_DOCTOR_MORNING_SELECTED"
    },
    {
      "prompt": "After a busy morning, the doctor has a lunch break.",
      "badge": "after",
      "expect": "BADGE_TAPPED"
    },
    {
      "prompt": "One o'clock — even doctors need to eat and rest. Just a short break before the afternoon! Press Lunch break!",
      "expect": "PRESET_DOCTOR_LUNCH_SELECTED"
    },
    {
      "prompt": "Next, the doctor checks on all the patients in the afternoon.",
      "badge": "next",
      "expect": "BADGE_TAPPED"
    },
    {
      "prompt": "Three o'clock — the doctor walks around checking everyone is getting better. Press Afternoon ward!",
      "expect": "PRESET_DOCTOR_AFTERNOON_SELECTED"
    },
    {
      "prompt": "Last of all, the doctor goes home to rest.",
      "badge": "last",
      "expect": "BADGE_TAPPED"
    },
    {
      "prompt": "Press Go home!",
      "expect": "PRESET_DOCTOR_HOME_SELECTED",
      "feedback": "Six o'clock — the doctor's day is done. Arrive, see patients, lunch, afternoon rounds, then home. Doctors work so hard to help us all!"
    }
  ]
}
