{
  "id": "word-builder-lesson-left_to_right",
  "title": "Left to Right",
  "number": 4,
  "guide": "cat",
  "source": "Word Builder",
  "criteria": [
    "literacy.print-concepts",
    "literacy.phonics",
    "literacy.word-recognition",
    "pd.fine-motor",
    "psed.self-regulation"
  ],
  "pageControls": ["MODE_DISTRACTORS", "SHOW_PICTURE"],
  "steps": [
    {
      "prompt": "Words always go from left to right — first letter on the left, last letter on the right! Build bus — start on the left!",
      "pageControls": ["SET_WORD_bus"],
      "expect": "WORD_bus_BUILT",
      "feedback": "b-u-s — b then u then s — left to right. Now build cow!"
    },
    {
      "pageControls": ["SET_WORD_cow"],
      "expect": "WORD_cow_BUILT",
      "feedback": "c first on the left, w last on the right. Now build bull!"
    },
    {
      "pageControls": ["SET_WORD_bull"],
      "expect": "WORD_bull_BUILT",
      "feedback": "b-u-l-l — always left to right. Now build lion!"
    },
    {
      "pageControls": ["SET_WORD_lion"],
      "expect": "WORD_lion_BUILT",
      "feedback": "l-i-o-n from left to right. Last one — build horse!"
    },
    {
      "pageControls": ["SET_WORD_horse"],
      "expect": "WORD_horse_BUILT",
      "feedback": "h-o-r-s-e — left to right, every time. That's how every word is written!"
    }
  ]
}
