{
  "id": "make_three",
  "title": "Make Three",
  "number": 1,
  "guide": "cat",
  "source": "Numbers",
  "criteria": [
    "maths.counting-5",
    "maths.subitising",
    "maths.numeral-recognition"
  ],
  "steps": [
    {
      "prompt": "Keep pressing + until the Total shows 3!",
      "expect": "TOTAL_3",
      "feedback": "Three {fruit_a_p}!"
    },
    {
      "expect": "COUNT_ALL",
      "feedback": "You counted them all!",
      "prompt": "Tap the Total to count them all!"
    }
  ]
}
