{
  "id": "object-playground-lesson-where-does-it-go",
  "title": "Where Does It Go?",
  "number": 5,
  "source": "Object Playground",
  "type": "lesson",
  "guide": "cat",
  "criteria": ["maths.spatial", "cl.technical-vocab", "pd.fine-motor", "cl.topic-vocabulary"],
  "pageControls": ["CLEAR_CANVAS", "SPAWN_CIRCLE", "LOCK_COLOUR_CONTROLS", "LOCK_SIZE_CONTROLS", "LOCK_SHAPE_CONTROLS", "LOCK_ADD_REMOVE", "LOCK_ROTATION"],
  "steps": [
    {
      "prompt": "Press the UP arrow to move your object UP!",
      "expect": "MOVED_UP",
      "feedback": "Up it goes! Higher and higher."
    },
    {
      "prompt": "Now press DOWN — send it down!",
      "expect": "MOVED_DOWN",
      "feedback": "Down! It went down."
    },
    {
      "prompt": "LEFT now — move it to the left!",
      "expect": "MOVED_LEFT",
      "feedback": "To the left! Good."
    },
    {
      "prompt": "And RIGHT — move it to the right!",
      "expect": "MOVED_RIGHT",
      "feedback": "Right! Up, down, left, right — you know all four directions!"
    },
    {
      "prompt": "Now drag it with your finger — move it wherever you like!",
      "expect": "OBJECT_DRAGGED",
      "pageControls": ["UNLOCK_ALL"],
      "feedback": "You moved it! You can put things exactly where you want them."
    }
  ]
}
