{
  "id": "circular_words",
  "title": "Round Letter Words",
  "number": 7,
  "guide": "dog",
  "filter": "animals",
  "source": "Trace Words",
  "criteria": [
    "pd.fine-motor-circular",
    "pd.fine-motor",
    "literacy.letter-formation",
    "literacy.phonics",
    "cl.topic-vocabulary"
  ],
  "words": ["dog", "frog", "goat", "octopus", "crocodile"],
  "shapeDecomp": {
    "d": ["curve", "straight line"],
    "o": ["circle"],
    "g": ["curve", "straight line"],
    "f": ["straight line", "curve"],
    "r": ["straight line", "curve"],
    "a": ["curve", "straight line"],
    "t": ["straight line", "curve"],
    "c": ["curve"],
    "p": ["straight line", "curve"],
    "u": ["curve"],
    "s": ["curve"],
    "i": ["straight line"],
    "l": ["straight line"],
    "e": ["straight line", "curve"]
  },
  "steps": [
    {
      "prompt": "Some letters are made with a round curve — like c, o, d, and g. Find dog — it has two round letters!",
      "expect": "WORD_dog_TRACED",
      "feedback": "Dog! d and g — both made with a round curve. Find frog — spot the round o in the middle!"
    },
    {
      "expect": "WORD_frog_TRACED",
      "feedback": "Frog! Did you feel that round o? Now find goat — two round letters again!"
    },
    {
      "expect": "WORD_goat_TRACED",
      "feedback": "Goat! g and o — both round. Now find octopus — it starts with a big circle!"
    },
    {
      "expect": "WORD_octopus_TRACED",
      "feedback": "Octopus! That o leads the way. Last one — find crocodile — it's full of round letters!"
    },
    {
      "expect": "WORD_crocodile_TRACED",
      "feedback": "Crocodile! c, r, o, c, o, d — five round letters in one word! You mastered the round letters!"
    }
  ]
}
