{
  "id": "medical_words",
  "title": "At the Doctor",
  "number": 8,
  "guide": "cat",
  "filter": "medical",
  "source": "Trace Words",
  "criteria": [
    "cl.technical-vocab",
    "uw.community",
    "cl.topic-vocabulary",
    "literacy.word-recognition",
    "pd.fine-motor"
  ],
  "words": ["nurse", "pill", "plaster", "bandage"],
  "steps": [
    {
      "prompt": "Doctors and nurses use special words! Find nurse and trace it!",
      "expect": "WORD_nurse_TRACED",
      "feedback": "Nurse! A nurse helps people feel better. Find pill!"
    },
    {
      "expect": "WORD_pill_TRACED",
      "feedback": "Pill! A small medicine that helps you get well. Find plaster!"
    },
    {
      "expect": "WORD_plaster_TRACED",
      "feedback": "Plaster! Goes on a cut to help it heal. Last one — find bandage!"
    },
    {
      "expect": "WORD_bandage_TRACED",
      "feedback": "Bandage! Wraps around a hurt part to protect it. nurse, pill, plaster, bandage — you know the doctor words!"
    }
  ]
}
