{
  "id": "emotion_words",
  "title": "How Are You Feeling?",
  "number": 3,
  "guide": "cat",
  "filter": "emotions",
  "source": "Trace Words",
  "criteria": [
    "cl.feeling-vocabulary",
    "psed.emotion-vocab",
    "cl.topic-vocabulary",
    "literacy.word-recognition",
    "pd.fine-motor"
  ],
  "words": ["sad", "happy", "angry", "calm", "scared"],
  "steps": [
    {
      "prompt": "Feelings have names — and you can write them! Find sad and trace it!",
      "expect": "WORD_sad_TRACED",
      "feedback": "Sad. Everyone feels sad sometimes — and now you can write it. Find happy!"
    },
    {
      "expect": "WORD_happy_TRACED",
      "feedback": "Happy! Five letters for a wonderful feeling. Find angry!"
    },
    {
      "expect": "WORD_angry_TRACED",
      "feedback": "Angry. A big feeling — five letters. Find calm!"
    },
    {
      "expect": "WORD_calm_TRACED",
      "feedback": "Calm. Four quiet letters. Last one — find scared!"
    },
    {
      "expect": "WORD_scared_TRACED",
      "feedback": "Scared! Six letters — you can write that feeling now. sad, happy, angry, calm, scared — every feeling has a word!"
    }
  ]
}
