{
  "id": "object-playground-lesson-spin-it-round",
  "title": "Spin It Round",
  "number": 6,
  "source": "Object Playground",
  "type": "lesson",
  "guide": "cat",
  "criteria": ["pd.fine-motor-circular", "cl.descriptive-vocab", "cl.topic-vocabulary", "pd.fine-motor"],
  "pageControls": ["CLEAR_CANVAS", "SPAWN_TRIANGLE", "LOCK_COLOUR_CONTROLS", "LOCK_SIZE_CONTROLS", "LOCK_SHAPE_CONTROLS", "LOCK_ADD_REMOVE", "LOCK_DIRECTION_BUTTONS"],
  "steps": [
    {
      "prompt": "Can you make your object SPIN? Use the rotation button to turn it!",
      "expect": "OBJECT_ROTATED",
      "feedback": "It's turning! Round and round like a wheel."
    },
    {
      "prompt": "Keep turning — can you turn it all the way round?",
      "expect": "OBJECT_ROTATED",
      "feedback": "Going round and round!"
    },
    {
      "prompt": "Now try the other way — can you turn it back?",
      "expect": "OBJECT_ROTATED",
      "pageControls": ["UNLOCK_ALL"],
      "feedback": "The other way! You can spin it both ways."
    }
  ]
}
